{
  "schema": "hfo.carrier-capability-envelope.v1",
  "carrier_episode_uuid": "11111111-1111-4111-8111-111111111111",
  "observed_utc": "2098-12-31T23:00:00Z",
  "fresh_until": "2099-01-01T00:00:00Z",
  "harness": {"product":"example","model":"example","reasoning":null,"execution_surface":"example"},
  "skills": {"catalog_ref":"github:TTaoGaming/hfo-gen-142/.agents/skills","discovered":["twinling-pdsa"],"loaded":["twinling-pdsa"],"validation":"PASS"},
  "capabilities": [{"id":"oracle-vps","reachable":"PROVEN","admission":"ADMITTED","target_binding":"device:oracle","evidence_ref":"example:replace-with-live-evidence"}],
  "authority": {"effect_ceiling":"NO_EXTERNAL_EFFECT","protected_effects":[],"authority_ref":"example:replace-with-live-authority"},
  "admission": {"workload_id":"EXAMPLE_ONLY","decision":"ADMIT","reasons":[],"required_skill":"twinling-pdsa","required_target":"oracle-vps"},
  "limitations": ["EXAMPLE_ONLY_NOT_LIVE_EVIDENCE"]
}